[
  {
    "id": "cdc-adhd-classroom",
    "titulo": "ADHD in the Classroom: Helping Children Succeed in School",
    "organizacion": "Centers for Disease Control and Prevention (CDC)",
    "tipo": "guia-oficial",
    "url": "https://www.cdc.gov/adhd/treatment/classroom.html",
    "idiomaOriginal": "en",
    "consultado": "2026-09-09"
  },
  {
    "id": "cast-udl-guidelines",
    "titulo": "Universal Design for Learning Guidelines",
    "organizacion": "CAST",
    "tipo": "guia-oficial",
    "url": "https://udlguidelines.cast.org/",
    "idiomaOriginal": "en",
    "consultado": "2026-09-09",
    "nota": "Marco DUA: Compromiso (por qué), Representación (qué) y Acción/Expresión (cómo) del aprendizaje."
  },
  {
    "id": "understood-udl",
    "titulo": "Universal Design for Learning (UDL): A teacher's guide",
    "organizacion": "Understood.org",
    "tipo": "organizacion",
    "url": "https://www.understood.org/en/articles/understanding-universal-design-for-learning",
    "idiomaOriginal": "en",
    "consultado": "2026-09-09"
  },
  {
    "id": "autism-speaks-classroom",
    "titulo": "Autism in the classroom: Strategies for success",
    "organizacion": "Autism Speaks",
    "tipo": "organizacion",
    "url": "https://www.autismspeaks.org/tool-kit-excerpt/autism-classroom-strategies",
    "idiomaOriginal": "en",
    "consultado": "2026-09-09"
  },
  {
    "id": "nea-teaching-autism",
    "titulo": "Teaching Students with Autism: A Guide for Educators",
    "organizacion": "National Education Association (NEA)",
    "tipo": "organizacion",
    "url": "https://www.nea.org/resource-library/teaching-students-autism-guide-educators",
    "idiomaOriginal": "en",
    "consultado": "2026-09-09"
  },
  {
    "id": "national-autistic-society-education",
    "titulo": "Education and autism — resources for schools",
    "organizacion": "National Autistic Society (UK)",
    "tipo": "organizacion",
    "url": "https://www.autism.org.uk/advice-and-guidance/topics/education",
    "idiomaOriginal": "en",
    "consultado": "2026-09-09"
  },
  {
    "id": "chadd-educators",
    "titulo": "For Educators — ADHD in the classroom",
    "organizacion": "CHADD (Children and Adults with ADHD)",
    "tipo": "organizacion",
    "url": "https://chadd.org/for-educators/overview/",
    "idiomaOriginal": "en",
    "consultado": "2026-09-09"
  },
  {
    "id": "cadah-tdah-aula",
    "titulo": "El manejo del TDAH en el aula: estrategias para el éxito",
    "organizacion": "Fundación CADAH",
    "tipo": "organizacion",
    "url": "https://www.fundacioncadah.org/web/articulo/el-manejo-del-tdah-en-el-aula-estrategias-para-el-exito.html",
    "idiomaOriginal": "es",
    "consultado": "2026-09-09"
  },
  {
    "id": "neuronup-tdah-docentes",
    "titulo": "Guía para docentes: el TDAH en el aula",
    "organizacion": "NeuronUP",
    "tipo": "organizacion",
    "url": "https://neuronup.com/estimulacion-y-rehabilitacion-cognitiva/trastornos-del-neurodesarrollo/tdah-trastorno-de-atencion-con-hiperactividad/guia-para-docentes-el-tdah-en-el-aula/",
    "idiomaOriginal": "es",
    "consultado": "2026-09-09"
  },
  {
    "id": "autismo-espana",
    "titulo": "Recursos educativos y educación inclusiva para el alumnado con autismo",
    "organizacion": "Confederación Autismo España",
    "tipo": "organizacion",
    "url": "https://autismo.org.es/",
    "idiomaOriginal": "es",
    "consultado": "2026-09-09"
  },
  {
    "id": "dua-colombia-decreto-1421",
    "titulo": "Diseño Universal para el Aprendizaje (DUA) en el marco de la educación inclusiva (Decreto 1421 de 2017)",
    "organizacion": "Ministerio de Educación Nacional de Colombia / Educación y Educadores",
    "tipo": "articulo-academico",
    "url": "http://www.scielo.org.co/scielo.php?script=sci_arttext&pid=S0123-12942025000102811",
    "idiomaOriginal": "es",
    "consultado": "2026-09-09",
    "nota": "El Decreto 1421 de 2017 regula la atención educativa a la población con discapacidad y promueve el DUA en Colombia."
  },
  {
    "id": "dsm-5-tr-apa",
    "titulo": "Manual Diagnóstico y Estadístico de los Trastornos Mentales (DSM-5-TR)",
    "organizacion": "American Psychiatric Association (APA)",
    "tipo": "libro",
    "url": "https://www.psychiatry.org/psychiatrists/practice/dsm",
    "idiomaOriginal": "en",
    "consultado": "2026-09-09",
    "nota": "Referencia clínica de autoridad para las características del TDAH y el TEA. INNIA la usa para fundamentar descripciones en contexto EDUCATIVO; no la usa para diagnosticar. Contenido con derechos de autor: se cita y se parafrasea, no se reproduce."
  },
  {
    "id": "who-icd-11",
    "titulo": "Clasificación Internacional de Enfermedades, 11.ª revisión (CIE-11 / ICD-11)",
    "organizacion": "Organización Mundial de la Salud (OMS)",
    "tipo": "guia-oficial",
    "url": "https://icd.who.int/",
    "idiomaOriginal": "en",
    "consultado": "2026-09-09",
    "nota": "Clasificación internacional de referencia (uso frecuente en Colombia/Latinoamérica). Fundamenta características; no se usa para diagnosticar."
  },
  {
    "id": "nice-ng87-adhd",
    "titulo": "Attention deficit hyperactivity disorder: diagnosis and management (NG87)",
    "organizacion": "National Institute for Health and Care Excellence (NICE)",
    "tipo": "guia-oficial",
    "url": "https://www.nice.org.uk/guidance/ng87",
    "idiomaOriginal": "en",
    "consultado": "2026-09-09",
    "nota": "Guía clínica basada en evidencia sobre TDAH; sustenta recomendaciones de apoyo en el entorno educativo."
  },
  {
    "id": "nice-cg170-autism",
    "titulo": "Autism spectrum disorder in under 19s: support and management (CG170)",
    "organizacion": "National Institute for Health and Care Excellence (NICE)",
    "tipo": "guia-oficial",
    "url": "https://www.nice.org.uk/guidance/cg170",
    "idiomaOriginal": "en",
    "consultado": "2026-09-09",
    "nota": "Guía clínica basada en evidencia sobre TEA en menores; sustenta recomendaciones de apoyo educativo."
  }
]
